ppl tap dance likely happen sydney worried offend terrorist prayer sydneysiege,  politibunny steerpike black flag window clue hint jolly roger,  superaaronburr politibunny ali sin buffalocharge think pork sandwich rule,  steerpike politibunny hostages fact jihadist flag fact terror fact leaping judgement fact,australia long black monday rabiddogg politibunny jeffraykovich shidelerk skiplacombe spcjackalope,journos maybe australia cojone politibunny,flag sydneysiege belong extremist group jabhat al nusra speculate right steerpike,  politibunny ali sin buffalocharge fear go end,  superaaronburr politibunny ali sin buffalocharge backpack withstand acid,obesity chocolate cause right diabeetus politibunny steerpike,  politibunny buffalocharging adopt ' extremist ' view try rob mcdonald stick,  melissajeweller politibunny newsaus abcnew disney report miss piratesofthecarribean flag help authority,  politibunny hope sas fill terroist lead,  jermhudson politibunny ali sin buffalocharge need umpa loompa swat team small causality way,  steerpike politibunny shidelerk skiplacombe spcjackalope jihad cherry pick naughty naughty way mo,bet money steerpike,reliance traveller jihad mean war agnst non muslims steerpike politibunny skiplacombe spcjackalope http t co mwhpb hry,explain jihad thing murder politibunny shidelerk skiplacombe spcjackalope,  politibunny clear go thank concern,yes comment direct sensible reporting wevealreadywon jclady politibunny,  steerpike politibunny skiplacombe funny miss news right winger take caf hostage hm,people flag belong extremist group jabhat al nusra probably typical psycho ali sin buffalocharge,  steerpike politibunny funny dumb historically accurate funny,  jeffraykovich lt stand politibunny shidelerk skiplacombe steerpike,  politibunny yell allahu akbar mentally ill politic think know situation,  politibunny jaylee empathy hope virgin look like napoleon dynamite virgin virgin,say likely foolish report fact confirm aussie medium good job jclady politibunny,  buffalocharge politibunny know motive assume thing mentally ill people world,  politibunny steerpike listen pick color deed,likely raid morning thing early need fact cinfidel politibunny,  ali sin buffalocharge right amp lot follow islam politibunny,  jaylee certainly hope terrorist hold ppl hostage empathetic bleed heart,  politibunny course inkling tea partier news fact,  politibunny steerpike shidelerk skiplacombe spcjackalope think dirt chocolate shop sugar deprivation,  politibunny ali sin buffalocharge look like pig smell like pig sound like pig definitely giraffe,  jclady steerpike politibunny wow board maybe steer build sign sure like,  superaaronburr politibunny ali sin buffalocharge cromnibus bill read,  politibunny steerpike workplace violence,  politibunny ali sin buffalocharge black flag say alah god,  politibunny steerpike trust muslim tell late not arabs tcot,  politibunny ali sin buffalocharge like worldview shit usually think,  politibunny bingo world pc good end saynototerrorism,  steerpike think hostage feel terror right make terrorist organization,  lollipopsdoll politibunny m hostage sa,sound like pc bs keep rational people talk reality go steerpike,  politibunny steerpike look way point expert,lol laugh rabiddogg politibunny steerpike jeffraykovich shidelerk skiplacombe spcjackalope,  politibunny cutrealty ali sin buffalocharge bunny maybe poor derange jihadist feel bit misunderstood,  politibunny anti water board freak pull terrorist,  politibunny ali sin buffalocharge judge wave jihadi flag hold people gunpoint terrorist,  politibunny stevesaul live feed find https t co alo pj tip,  say guy machine gun backpack hold hostage jihadi flag terrorist ali sin buffalocharge,  politibunny jermhudson ali sin buffalocharge twinkee marshmallow,  jermhudson politibunny ali sin buffalocharge talkin ',  fanoliberty politibunny ali sin watch go find troll hostage taker oh noe,share fear angry time ericreedgraa ali sin buffalocharge,  politibunny steerpike terrorism bill cosby unquestionably rape woman mike brown arm,  thebonfiremedia harbinger skiplacombe spcjackalope steerpike islamist matter,  politibunny hostage act terrorist act islamic home grow crime,  jrlb politibunny ali sin buffalocharge gr mbthp,  politibunny buffalocharging stop throw world terrorist freely,  politibunny skiplacombe steerpike nut yeah death cult like islam tendency attract ya know,  ali sin pariahpotimouth propose right definition,  steerpike bad coffee joke politibunny jeffraykovich shidelerk skiplacombe spcjackalope,  politibunny cutrealty ali sin buffalocharge anxious meet virgin,  steerpike politibunny complex,  politibunny steerpike think group iza bunza nutzbagh,  steerpike jclady politibunny pretend journalist human nature judgement base experience,  major skidmark politibunny terrorist terrorist doubt feeling catch,  politibunny ali sin buffalocharge train disciplined psycho amp jihadist kill muslim empathy ass,  politibunny want sniper bullet fly true,  ivanv yeah politibunny steerpike jeffraykovich shidelerk skiplacombe spcjackalope,  politibunny buffalocharging come city recently shoot mentally ill person label ' terrorist ',  superaaronburr politibunny ali sin buffalocharge problem world today solve sniper rifle,  bornfree underwear politibunny ali sin buffalocharge,misunderstood person happen want chop head politibunny steerpike,  politibunny steerpike cvmon bunny stop stereotype terrorist derranged sociopath,  politibunny cuz need understand empathize terrorist duh ask hilary,  politibunny yes ft hood call ' workplace violence ',jihad jihad jeffraykovich politibunny shidelerk skiplacombe spcjackalope,  politibunny joeleigh lol know racist terrorist life matter lol,easy way pronounce stick finger throat coslopus harbinger skiplacombe spcjackalope steerpike,  politibunny think hostage situation require knowledge fact,  sigh point careful journalism practise absolutely know politibunny,  jrlb politibunny ali sin buffalocharge possible need sharp point head understand,motive unconfirmed fact jclady politibunny,likely yes fact complex politibunny,  aztlanconnect politibunny roll tonight,  ivanv bad joke kill politibunny steerpike jeffraykovich shidelerk skiplacombe spcjackalope,  pariahpotimouth know word hold weight amp poor way use day,  politibunny know motivation pm abbott say presser insta expert twitter,murderer use religion excuse murder spcjackalope politibunny shidelerk skiplacombe,wait decide kill gotcha steerpike shidelerk skiplacombe spcjackalope,jihad religious duty resistance struggle kill politibunny shidelerk skiplacombe spcjackalope,  politibunny ali sin buffalocharge backpack large hostage,  politibunny steerpike hold tea party flag journo scream roof top,  politibunny shidelerk skiplacombe spcjackalope steerpike jihad,  politibunny ali sin buffalocharge believe islamic event convince real target usually exit plan,right wing paramilitary group spcjackalope politibunny skiplacombe,flag jihadist group know jihadist steerpike,  politibunny steerpike jeffraykovich shidelerk skiplacombe maybe customer order large coffee amp offend,  politibunny ali sin buffalocharge terrible thing cause terror terrorist,  politibunny jermhudson ali sin buffalocharge oh probably gideon bible march dime info maybe baby chipmunk,broad take politibunny know lone nut organise terrorism,chocolate shop make bad politibunny jeffraykovich shidelerk skiplacombe spcjackalope,  melissajeweller right think happen armed robbery smh,jab hat funny coslopus politibunny harbinger skiplacombe spcjackalope steerpike,  politibunny individual declaration motivation rely fact speculation,  politibunny sure pronounce right https t co yxzjj arr skiplacombe spcjackalope steerpike,  steerpike politibunny shidelerk skiplacombe include word jihad murder video post coincidence,jihad jihad jihad purpose jihad shidelerk skiplacombe spcjackalope steerpike,  steerpike spcjackalope politibunny skiplacombe right sit worried r go to crucify puhleeze,  jaylee politibunny,lock jewish school consulate evacuate americans tell high alert cutrealty ali sin buffalocharge,  crack yeah great timing rabiddogg politibunny steerpike jeffraykovich shidelerk skiplacombe spcjackalope,  steerpike politibunny face palm fact,  jermhudson politibunny ali sin buffalocharge maybe probably boattail round,  politibunny steerpike probably abundance caution feel like go,  joeleigh politibunny bada bing mama mia lol,  politibunny ali sin buffalocharge shoot nsw tactical response unit great bunch guy ability amp tool,  steerpike politibunny jihadist flag try protect,clearly dark chocolate briankonty politibunny,  politibunny ali sin lol http t co pzkcmhbf,  latheman politibunny ali sin buffalocharge maybe u shld research david axlerod amp bill ayer obama pal guilty terrorist act,  politibunny steerpike bias want believe happen mean actually happen,terrorist question wave flag represent jihadist group ali sin buffalocharge,  jermhudson politibunny ali sin buffalocharge sure behead,  politibunny spcjackalope steerpike shidelerk skiplacombe semantic allah devotee bloodthirsty god solid,  byoung politibunny send hillary right sydney sympathize hostage taker,interesting unfold aussie play rabiddogg ivanv politibunny steerpike jeffraykovich shidelerk,  superaaronburr politibunny jermhudson ali sin buffalocharge exactly,  buffalocharge politibunny fuck terrorist,  politibunny shidelerk skiplacombe spcjackalope steerpike purpose eliminate fucking jihad,  politibunny call terrorist consider torture time bunny terrorist feeling,winner gt politibunny,  buffalocharge think workplace violence lol,  jaylee politibunny leftist ausie concerned come abbott mouth care trap,true congress ali sin buffalocharge politibunny,  politibunny steerpike black flag arabic writing pretty good indication be sell cookie islam,  superaaronburr politibunny ali sin buffalocharge sniper well wait frontal shot contain obamacare bill,  politibunny jermhudson ali sin buffalocharge college book hand oh wait wrong story,  steerpike politibunny shidelerk skiplacombe know religion time hint buddhist,think backpack sparky jermhudson ali sin buffalocharge,  politibunny ali sin buffalocharge secondary event ensure good coverage fit right,jihad coffee shop jihad damn decaf steerpike jeffraykovich shidelerk skiplacombe spcjackalope,  jermhudson politibunny ali sin buffalocharge yeah probably child bride stuff,lol mean sure ali sin buffalocharge,  politibunny ali sin buffalocharge yea tea party real terrorist oh emm gee,  politibunny ali sin buffalocharge let shoot find,amish know spcjackalope steerpike shidelerk skiplacombe,u get wrong end stick ' professional news reporting leap judgement jclady politibunny,  politibunny ali sin buffalocharge lol awesome intel analyst,  politibunny harbinger skiplacombe spcjackalope steerpike yes merge isis,pay big buck lol hope wrong hope toy gun guy mentally ill jaylee ali sin,  politibunny steerpike break puppet,flag sydneysiege belong extremist group jabhat al nusra thank skiplacombe spcjackalope steerpike,know fail thebucketshop politibunny skiplacombe spcjackalope,  politibunny hillary tell sympathize geez,  trknangel politibunny ali sin buffalocharge research sweetie gt gt gt sarcasm,  politibunny skiplacombe spcjackalope steerpike generic black shahada flag terrorist cud favor jihadi group point,  politibunny offer pumpkin spice latte steerpike jeffraykovich shidelerk skiplacombe spcjackalope,  latheman politibunny ali sin buffalocharge recall t partier behead bombing innocent like obama pal,  politibunny actually steerpike mistweet
hour night fall sydney hostage remain inside cafe http t co o ggjyxw c sydneysiege http t co svf iyewc,  mashable hour night fall sydney hostage remain inside cafe http t co hfgywwarqo sydneysiege,  mashable coffee sydneysiege,  mashable yup non muslim thread person religion,  mashable hour sydney hostage remain inside cafe http t co c wkdj t sydneysiege http t co av dlfrem,  mashable light,heart go friend sydney go cc mashable http t co tlnjnlpkob sydneysiege http t co wavxfzwaxw,  mashable let hope end soon casualty sydneysiege,  know offender amp islamic flag window rt mashable hour unconfirmed hostage remain cafe http t co zxowiwc zx sydneysiege,,,,,,,,,,,,,,,,,,,,,,,,,,,,,,,,,,,,,,,,,,,,,,,,,,,,,,,,,,,,,,,,,,,,,,,,,,,,,,,,,,,,,,,,,,,,,,,,,,,,,,,,,,,,,,,,,,,,,,,,,,,,,,,,,,,,,,,,,,,,,,,,,,,,,,,,,,
number hostage take amish today zero lt religion peace look like sydneysiege,  lsdj lvl point think mom basement trollblocke,  javaguysammckee mean sydney siege promote amish religion peaceful nation normal,  jesrmcclure point exactly religion peace talk behead ppl day,  javaguysammckee gaypatriot happy religion honorable war like jews lutherans,  jesrmcclure talk amish think hard know hint involve behead,  javaguysammckee prayer flag directly link isis isil stop stoke hype train bellend,  javaguysammckee jesrmcclure isis represent islam host islamic scholar condemn act amp,  javaguysammckee yes point know religious group quit hate speech,  clayjohanson javaguysammckee happen will assumption christian evil act single misguided,  jesrmcclure dispute peaceful nation change muslim population grow see precursor,  javaguysammckee care talk amish,  javaguysammckee islam not people hostage fanatic call muslim judge entire religion,  xuchilbara lsdj lvl scumbag demand isis flag islam lol,  uzairahmed javaguysammckee christian commit act violence muslim wanna hear fucking peep,  jesrmcclure suppose mean,  jesrmcclure um promote amish note actual religion peace,  javaguysammckee think dog act peddle kind time save later mate,  lsdj lvl javaguysammckee ' muhammad ' flag religion get http t co tw zzzc t,  javaguysammckee behead hundred thousand group believe,  javaguysammckee navymom problem ambush refuse fight country,,,,,,,,,,,,,,,,,,,,,,,,,,,,,,,,,,,,,,,,,,,,,,,,,,,,,,,,,,,,,,,,,,,,,,,,,,,,,,,,,,,,,,,,,,,,,,,,,,,,,,,,,,,,,,,,,,,,,,,,,,,,,,,,,,,,,,,,,,,,,,
people take selfie sydneysiege return home look selfie amp unconscious blither idiot look like,  activist geez hear imagine selfie taker hiroshima auschwitz laugh go hell,,,,,,,,,,,,,,,,,,,,,,,,,,,,,,,,,,,,,,,,,,,,,,,,,,,,,,,,,,,,,,,,,,,,,,,,,,,,,,,,,,,,,,,,,,,,,,,,,,,,,,,,,,,,,,,,,,,,,,,,,,,,,,,,,,,,,,,,,,,,,,,,,,,,,,,,,,,,,,,,,
forget moment thousand muslim australia rejoice sydneysiege martinplace auspol http t co ehp okt f,  fem kat basimafaysal crap luvvie,  basimafaysal mean aussie aussie aussie n,  negijew basimafaysal judge not know fact hostage,  basimafaysal sharia democracy happen terrorist attack,  rajansinha basimafaysal democracy clash democracy sharia pakistan flavor sharia sharia finally,  xfile basimafaysal sheeple,  fem kat basimafaysal yes yes let withhold judgment til happen learn,simpleton commentator rush muslims disown revere jihadis sydneysiege martinplace auspil basimafaysal,spare thought million jihad victim china mideast usa uk thai philippines india auspol sydneyseige http t co y yymri eu,  basimafaysal fact people rejoice right know shit reportfact,great time mosque open day wear hijab sydneysiege martinplace auspil http t co saplgris,  basimafaysal scott exactly amp like antigovt abc have endlessly ridicule security stepup backpedal treachery,  fem kat basimafaysal charia revolution come wall defend muslims,  basimafaysal predict happen heart break neighbour ditch go scum,  basimafaysal time baseless crap,  fem kat basimafaysal picture clearly black flag jihad rocket science,  basimafaysal lupuscandoris point world,yes correct amp good time whitewash islam teach fem kat,  basimafaysal lakemba n blow mosque,  dwimidham basimafaysal look place like pakistan sharia guarantee terrorist attack,  basimafaysal wuhokay forget russia,  kingmenelaos wuhokay room france spain italy germany burma indonesia etc,  basimafaysal sharpestick strong prime minister sydney martinplace happen prepared,,,,,,,,,,,,,,,,,,,,,,,,,,,,,,,,,,,,,,,,,,,,,,,,,,,,,,,,,,,,,,,,,,,,,,,,,,,,,,,,,,,,,,,,,,,,,,,,,,,,,,,,,,,,,,,,,,,,,,,,,,,,,,,,,,,,,,,,,,,
insanity jihad come australia amp liberal lunatic concern political correctness sydneysiege tcot http t co yitcqlja,  amymek katyinindy think australia egypt denial rimshot thankyeew thankyewverehmuch,  amymek obama administration coordinate aussie talking point sound like,  dajsamarasinghe rebellionreport amymek workplace violence fight send theirs morgue,  amymek uh commish far know peta use flag like,  amymek jccwatch judt noisy pre xmas party,  amymek karlkroshinsky twould apear america amp australia hav sum tingz comon pcz terorists racism etc,  amymek total denial unreal,  dajsamarasinghe amymek liberal political correctness crock crap place world period,  dajsamarasinghe dulaney l amymek qualify hostage take jihadi flag terrorist event,amymek jihad come australia amp lib lunatic concern political correctness sydneysiege tcot http t co arttrsisn,  amymek bonzerwolf kricky shoot bastard,  amymek islamsuck http t co taas wq vf,  amymek think cautious sake hostage,,  amymek http t co j btidkyr,  dajsamarasinghe bwtanker amymek housefloor senatefloor senatorleahy senfeinstein senjohnmccain gop thedemocrat senatedem,  dajsamarasinghe rebellionreport amymek workplaceviolence wakeupamerica terrorism terrorism,  amymek head ass sand incredibly dense amp blind people,  amymek dajsamarasinghe art denial ridiculous,,,,,,,,,,,,,,,,,,,,,,,,,,,,,,,,,,,,,,,,,,,,,,,,,,,,,,,,,,,,,,,,,,,,,,,,,,,,,,,,,,,,,,,,,,,,,,,,,,,,,,,,,,,,,,,,,,,,,,,,,,,,,,,,,,,,,,,,,,,,,,,
today threat terrorism high yrs ago result support terror sydneysiege http t co gl vosnj x,  xmansv partisangirl corbettreport divide culprit gain information abeldanger surmise know detail,  partisangirl war instigate political commercial gain criminal,  partisangirl corbettreport real isis,  partisangirl corbettreport know plot need speak hang,  zloppolz meh guiness list lsd powerful drug existence fun lead,  zloppolz end topic faith patriot,  zloppolz partisangirl corbettreport oop accidently type mean,  zloppolz nuff say nice chatting,  zloppolz point somebody bad lsd trip ll end mental torture pain ur control ur mind,  xmansv operative deeply compromise die reveal relative eliminate north korea,  partisangirl upma go come pakistan not learn,  zloppolz ten option induce cooperation,  xmansv protect drug trade secret cia torture instill fear gain information,  zloppolz find escort little eit exploration,  partisangirl falluja http t co lcnlmvbdkm,  partisangirl mccain ahole surprising talk eit recently,  partisangirl ian guy try treason,,,,,,,,,,,,,,,,,,,,,,,,,,,,,,,,,,,,,,,,,,,,,,,,,,,,,,,,,,,,,,,,,,,,,,,,,,,,,,,,,,,,,,,,,,,,,,,,,,,,,,,,,,,,,,,,,,,,,,,,,,,,,,,,,,,,,,,,,,,,,,,,,
pray sydney thank heaven stream foreign network american medium completely mia,  dloesch confirm cnn give sunday night race relate breaking story,  dloesch forget twitter,  dloesch fox news online,  dloesch ue newstalk give good coverage,  dloesch wellfonder thank god technology social medium know,  dloesch stun cnn finally go live,  govesq move baby seal viral video report heaven,  dloesch seriously kind disgusting break,  dloesch bad conceal carry australia,  dloesch useful facebook https t co ynxwajhsum futureofgod energyofattraction,  dloesch pray people sydney,  dloesch friend austraila say anti gun false flag global leader agenda push un small arm treaty,  dloesch fair cnn say police incident,  dloesch pray sydney thank heaven stream foreign network american medium completely mia,  dloesch find,  dloesch usual will report make muzzie look like victim,,,,,,,,,,,,,,,,,,,,,,,,,,,,,,,,,,,,,,,,,,,,,,,,,,,,,,,,,,,,,,,,,,,,,,,,,,,,,,,,,,,,,,,,,,,,,,,,,,,,,,,,,,,,,,,,,,,,,,,,,,,,,,,,,,,,,,,,,,,,,,,,,,
think mate sydney hope okay,  dankanter love u,  dankanter hi,  jbsmyhope rt https t co j snefxot,  dankanter wait day log amp scream lung see follower list follow p,  dankanter follow pleaseeee,,  dankanter wait day log amp scream lung see follower list follow d,,  dankanter yes family thought prayer,  dankanter daaaaan,,  dankanter follow pleaseeeeee,  dankanter dan notice,  dankanter folow love,  dankanter hey dan follow,,  dankanter hey,,  dankanter follow,  dankanter dannnnnnnnnnnn come brazilll,,,,,,,,,,,,,,,,,,,,,,,,,,,,,,,,,,,,,,,,,,,,,,,,,,,,,,,,,,,,,,,,,,,,,,,,,,,,,,,,,,,,,,,,,,,,,,,,,,,,,,,,,,,,,,,,,,,,,,,,,,,,,,,,,,,,,,,,,,,,,,
respect people sydney show solidarity good way deal extremism illridewithyou,  billybragg respect people sydney show solidarity good way deal extremism illridewithyou,  billybragg sure politician stop illridewithyou love start stir hate,  billybragg respect people sydney show solidarity good way deal extremism illridewithyou,  billybragg try find form word support sydneysider sum perfectly thankyou,  billybragg mean,  billybragg see racist comment twitter facebook,  billybragg say,  adamnoble bit understand,  billybragg respect people sydney show solidarity good way deal extremism illridewithyou,  billybragg people right thank look,  billybragg respect people sydney show solidarity good way deal extremism illridewithyou,  scrumpoacher read timeline bloody extremist wonder upset people stand,  billybragg load shit,  billybragg cough melbourne cough,  hayspender clickbrrrrrrrrrrrrrrrrrrr,  billybragg zzzzzzzzzzzzzzzzzzzzzzzzz,  billybragg united support muslim community amp want peaceful resolution,  billybragg woman inspire sydney woman start melbourne,  scrumpoacher side extremist eh,,,,,,,,,,,,,,,,,,,,,,,,,,,,,,,,,,,,,,,,,,,,,,,,,,,,,,,,,,,,,,,,,,,,,,,,,,,,,,,,,,,,,,,,,,,,,,,,,,,,,,,,,,,,,,,,,,,,,,,,,,,,,,,,,,,,,,,,,,,,,,,
