hour focus hostage situation sydney americans die gunshot momsdemand gunsense,  wallsofthecity colmorrisdavis thereminfan instead percent fail success rate method,  jimkey amp wrong wallsofthecity colmorrisdavis thereminfan,hand die regardless way tapdance blood gunsense fail colmorrisdavis momsdemand,doubt dead people care colmorrisdavis bitterclingerpa thereminfan,good fair point u personal knowledge suicide wallsofthecity rb cms colmorrisdavis momsdemand,sorry understand statistic work door run adult talk rb cms colmorrisdavis,  jimkey psychology completely opinion base go desire perceive norm bs wallsofthecity colmorrisdavi,  wallsofthecity thereminfan colmorrisdavis notable gun control country suicide rate comparable exist magic solution,obviously gun murder people kill gun dead colmorrisdavis bitterclingerpa thereminfan,  colmorrisdavis thereminfan wallsofthecity unlike response fa homicide prosecution costly incarceration bad optic,people want kill unfortunate gun contorl change thereminfan colmorrisdavis,  wallsofthecity colmorrisdavis thereminfan good point legality method shoot hang,  wallsofthecity colmorrisdavis momsdemand fact firsthand knowledge death suicide puleeeeez,  bitterclingerpa thereminfan wallsofthecity gun murder death toll month,  wallsofthecity colmorrisdavis momsdemand know people commit suicide citizen see gun,  wallsofthecity colmorrisdavis momsdemand brilliant defense gun ignorance alive,  wallsofthecity colmorrisdavis momsdemand awful,  wallsofthecity colmorrisdavis momsdemand investigate overall gun injury surely,  wallsofthecity colmorrisdavis bitterclingerpa bow people late southern hemisphere thank,  petedotascian colmorrisdavis momsdemand day year suppose possible,  colmorrisdavis momsdemand sydney police impressive cool considered careful,  wallsofthecity colmorrisdavis thereminfan lethality legality sorry try argumentative want opinion,http t co uae p th thereminfan colmorrisdavis momsdemand,  macnasaoirse wallsofthecity colmorrisdavis thereminfan guy point,  wallsofthecity colmorrisdavis thereminfan far people perish poisoning fall x mv accident ' perspective,course people choose effective mean fault decision thereminfan colmorrisdavis momsdemand,  colmorrisdavis bitterclingerpa wallsofthecity impression,  wallsofthecity colmorrisdavis thereminfan actually man likely use violent mean suicide likely,  wallsofthecity colmorrisdavis thereminfan american psychological association disagree,  bitterclingerpa wallsofthecity thereminfan gun death nearly intentional accident definition,  macnasaoirse wallsofthecity colmorrisdavis psychology empirically base account cultural societal norm,good thereminfan colmorrisdavis bitterclingerpa,unfortunately fixate gun death exactly colmorrisdavis try imply thereminfan bitterclingerpa,  wallsofthecity colmorrisdavis thereminfan large chance fail suicide attempt dead people violent mean,  wallsofthecity jimkey colmorrisdavis thereminfan well effective,  jimkey think make choice like mean matter wallsofthecity,australia show hypothesis false http t co uae p th jimkey colmorrisdavis thereminfan,think try kill care legality method jimkey colmorrisdavis thereminfan,  thereminfan wallsofthecity momsdemand yes suicide homicide,  wallsofthecity colmorrisdavis bitterclingerpa thank hopefully hostage piece,  colmorrisdavis glynmoody momsdemand indians die traffic accident,like people want parade ignorance statistic today seriousone rb cms colmorrisdavis momsdemand,  colmorrisdavis wallsofthecity thereminfan intentional suicide unlawful easily preventable mean,exactly aus actually show suicide substitution real people hangr thereminfan colmorrisdavis momsdemand,  wallsofthecity colmorrisdavis thereminfan fail help need,  colmorrisdavis momsdemand unreal real,  wallsofthecity jimkey colmorrisdavis thereminfan government intervene,  petedotascian colmorrisdavis momsdemand thank,  thereminfan wallsofthecity colmorrisdavis firearm homicide lt violent crime amp death homicide city,  bitterclingerpa wallsofthecity colmorrisdavis oh magic solution course wonder death,  wallsofthecity colmorrisdavis bitterclingerpa think say,colmorrisdavis ' tapdance blood suicide dead regardless gun change thereminfan,people choice agree mean need help jimkey colmorrisdavis thereminfan,  thereminfan wallsofthecity colmorrisdavis prayer care,sorry point fact ignorance war peace right rb cms colmorrisdavis momsdemand,  wallsofthecity colmorrisdavis momsdemand right suicide gun death,  glynmoody colmorrisdavis momsdemand figure http t co juvxzritt,  colmorrisdavis wallsofthecity momsdemand realise devastating,  wallsofthecity colmorrisdavis thereminfan try question go succeed,succeed try maim exactly go improve outlook jimkey colmorrisdavis thereminfan,  jimkey normality myth wallsofthecity colmorrisdavi,people choose kill effective disfigured maimed life thereminfan colmorrisdavis,think people want kill go jimkey colmorrisdavis thereminfan,  wallsofthecity colmorrisdavis thereminfan succeed man pill like woman,,,,,,,,,,,,,,,,,,,,,,,,,,,,,,,,,,,,,,,,,,,,,,,,,,,,,,,,,,,,,,,,,,,,,,,,,,,,,,,,,,,,,,,,,,,,,,,,,,
hat guy awesome faith humanity restore sydneysiege illridewithyou http t co iazcctca h,  rizkysaidr love love guy,  kawat rizkysaidr,  tinakolose rizkysaidr idiot kafir save humanity amp jihadi pig kill lear kafir u r war sydneysiege,  rizkysaidr america,feel rt rizkysaidr hat guy awesome faith humanity restore sydneysiege illridewithyou http t co ykoyictjm,  rizkysaidr awww love great work help feel save,  rizkysaidr wonderful muslim non muslims come atrocity illridewithyou,  rizkysaidr saksith amazing story ppl right live peacefully safely neighborhood religious ppl,  rizkysaidr mesharialmalki,  likenarnia rizkysaidr proud fellow australian walk tall religious attire walk,  likenarnia rizkysaidr wow think,  mesharialmalki rizkysaidr,  purpleblayz rizkysaidr glad humanity illridewithyou,  kawat rizkysaidr,  kawat rizkysaidr,  kawat rizkysaidr,  mesharialmalki rizkysaidr,  kawat rizkysaidr,heartwarme queernaut loud clear racist welcome sydneysiege illridewithyou http t co oxgeh wue,  rizkysaidr citizen,loud clear racist welcome sydneysiege illridewithyou http t co yeizibip vanbadham rizkysaidr,  queernaut vanbadham rizkysaidr beautiful,  rizkysaidr omg nearly cry read,  rizkysaidr hat guy awesome faith humanity restore sydneysiege illridewithyou http t co hxswzg z kudo,  kawat rizkysaidr,  rizkysaidr vanbadham feel humanity love feel safe think,,,,,,,,,,,,,,,,,,,,,,,,,,,,,,,,,,,,,,,,,,,,,,,,,,,,,,,,,,,,,,,,,,,,,,,,,,,,,,,,,,,,,,,,,,,,,,,,,,,,,,,,,,,,,,,,,,,,,,,,,,,,,,,,,,,,,,,,
hostage escape gunman see get extremely agitated shouting remain hostage,  chrisreason hi chris think able talk bbc newsnight live tomorrow morning time well,  chrisreason jesus h christ,  chrisreason understand dosnt police sniper idiot,  donshappelle antonyturner chrisreason sane arrogant self centre fuckwit,  antonyturner yes possibly know type glass worth bullet ricochet instead,  antonyturner exactly think s get tell public hope wrong,  sampathpanini irresponsible journalism journalist consideration family friend hostage,  antonyturner chrisreason exactly shoot terrorist police commissioner deputy incompetence,  becbollinger normally sniper fire shoot break glass second hit target conjecture,  antonyturner chrisreason terror plot foil fbi set entrapment know psyop public,  skyesongtoller accuse people rubberneck terrorist attack,  nikkifirewall need dead man switch,  antonyturner right hopefully ok,  robinclive chrisreason harsh,  skyesongtoller chrisreason report accuse job journo direct anger,  antonyturner chrisreason gun load public relation stunt gain public approval war spending,hostage escape gunman see get extremely agitated shout remain hostage chrisreason,  antonyturner chrisreason end result public approval spending draconian surveillance law security,  antonyturner chrisreason medium drive home narrative condition viewer work like charm,  donshappelle chrisreason s know police question,  grazinggoat yeah maybe reveal,  donshappelle chrisreason way s end result sure,  chrisreason hi chris short bbc thank,  chrisreason omg,  becbollinger chrisreason maybe clear shot d hate regret take later,  antonyturner chrisreason probably line window civilian shooting injure,  chrisreason lose respect journalist stop car crash journalism start take role seriously,  chrisreason hi chris mark bbc radio world uk see cnn talk,  chrisreason hostage escape gunman see get extremely agitated shouting remain hostage,  davidrule antonyturner chrisreason thoughtful thank,,,,,,,,,,,,,,,,,,,,,,,,,,,,,,,,,,,,,,,,,,,,,,,,,,,,,,,,,,,,,,,,,,,,,,,,,,,,,,,,,,,,,,,,,,,,,,,,,,,,,,,,,,,,,,,,,,,,,,,,,,,,,,,,,,,,
break sydney hostage taker believe self style muslim cleric face string violent charge,  ap iranian bear refugee tell australian deport iran problem solve,  ap break sydney hostage taker believe self style muslim cleric face string violent charge,  priyangmenon ap iranian actually,  ap report info help sydney police hostage save later active situation gunman use socmedia crave attn,  ap break sydney hostage taker believe self style muslim cleric face string violent charge,  ap aussie govt end sydneysiege night send kind gas c duct sedate terrorist unconscious,  ap shocker,  ap bad,  ap hggolightly creepy reason walk unmonitored place ugh,  jay ap probs cuz innocent people inside gun blaze gas throwing,likely pakistani ap,  ap break sydney hostage taker believe self style muslim cleric rep muslims sensationalize add fuel,  ap iranian refugee grow sunni shia family baluch kurd tony abbott agent,  ap break sydney hostage taker believe self style muslim cleric face string violent charge loser,  ap break sydney hostage taker believe self style muslim cleric face string violent charge,  ap imagine,  jay ap ah open fire stun grenade get hostage,  ummabdulmalik ap aussie govt use gas include terrorist unconscious storm amp capture,rt ap break sydney hostage taker believe self style muslim cleric face string violent charge,,,,,,,,,,,,,,,,,,,,,,,,,,,,,,,,,,,,,,,,,,,,,,,,,,,,,,,,,,,,,,,,,,,,,,,,,,,,,,,,,,,,,,,,,,,,,,,,,,,,,,,,,,,,,,,,,,,,,,,,,,,,,,,,,,,,,,,,,,,,,,,
call prayforhostage amp australia hostage fear amp hate sydneysiege http t co qaznfziuwa,  bamboozle commongraceaus tony salivate bring race riot,  commongraceaus jcalabra prayer religious hogswollop get point banreligion,  bamboozled commongraceaus bring law stop dissension amp privacy amp bob uncle brandi king,  commongraceaus indigenousx yeah need religion,  commongraceaus atheist will welcome,  commongraceaus call prayforhostage amp e sydneysiege http t co kaqtpsybmm,  commongraceaus pray hostage taker pray humanity pray calm pray end peacefully,  commongraceaus indigenousx god problem,,,,,,,,,,,,,,,,,,,,,,,,,,,,,,,,,,,,,,,,,,,,,,,,,,,,,,,,,,,,,,,,,,,,,,,,,,,,,,,,,,,,,,,,,,,,,,,,,,,,,,,,,,,,,,,,,,,,,,,,,,,,,,,,,,,,,,,,,,,,,,,,,,,,,,,,,,
  sydneysiege likely carry ' lone wolf ' minimal link organize terror group expert say http t co ynpfmqfgmj,  wsj lone wolf lately,  psychicwaugh wsj danielstacey canadian soldier murder canada november lonewolf jihadist,  wsj look like wannabe wrong flag probably market want aus police right flag moron,  wsj danielstacey hostage,  wsj danielstacey apparently coreligionist link require time explore connection terror prevention,  wsj lot lone wolf lately eh sound lone wolf keep happen,  wsj danielstacey narrative begin sydneysiege pjnet tpp tcot,  wsj damn mean massive reaction australia mind find link,  wsj tmurphynzh s think terrorist blow guy probably scared twit,  wsj uh huh,write book hostage terrorist terrorist hostage wsj,  wsj danielstacey want publicity s shoot sob,  wsj yes hallmark deluded loner flag tell v scary irrationality,  wsj http t co onugw owv dirty secret mention track innocent civilian w cancer cause radar west coast ban,  wsj lone wolf islamic terrorist,  wsj sydneysiege likely carry ' lone wolf ' minimal link organize terror group http t co ftx jdq,  wsj help amp feel well terror attack nonetheless,  wsj yusufdfi witness say threaten jihadis msm afraid,  wsj colormere minimalisze risk take,  wsj danielstacey apparently isis advocate supporter demand flag release,,,,,,,,,,,,,,,,,,,,,,,,,,,,,,,,,,,,,,,,,,,,,,,,,,,,,,,,,,,,,,,,,,,,,,,,,,,,,,,,,,,,,,,,,,,,,,,,,,,,,,,,,,,,,,,,,,,,,,,,,,,,,,,,,,,,,,,,,,,,,,
sydney siege end police storm lindt cafe hostage run http t co ek eyhbjxa,  guardian m nh t like share nha u h t ng lg http t co kmgizuzvt,  guardian lot worried muslim,  guardian illridewithyou,,,,,,,,,,,,,,,,,,,,,,,,,,,,,,,,,,,,,,,,,,,,,,,,,,,,,,,,,,,,,,,,,,,,,,,,,,,,,,,,,,,,,,,,,,,,,,,,,,,,,,,,,,,,,,,,,,,,,,,,,,,,,,,,,,,,,,,,,,,,,,,,,,,,,,,,,,,,,,,
australian use illridewithyou hashtag solidarity muslim sydney siege http t co h kwfwnyl,  ensteiner wish oz people show solidarity jewish population summer http t co lcj kuc s story,  daphnadreifus local school jewish happy chanukah,  ensteiner hear different account good hear support happy chanukah amp sydneysiege end soon amp peacefully,  time hear laughter background accompany comment bunch gullible sucker,s true patriot rt time australian use illridewithyou hashtag solidarity muslim sydney siege http t co taehvkj v,  time damn hostage,  time rizaniya god great,  time aussie classy people,s true patriot time australian use illridewithyou hashtag solidarity muslim sydney siege http t co taehvkj v,  time nice gesture primarily solidarity hostage worry later sydneysiege,,  daphnadreifuss not speak time sydney will let hatred win amp take care safety vulnerable ppl,  time wait people hold gun point freakin coffee shop,  time think hostage need solidarity,  kavita jade time,  time taking hostage situation abuse freedom god allow increase racial religious issue sag,  ensteiner wonderful wrong hostage actually grave danger feel focus,  time lot cowardly ppl,  time thank kneelandsan important respect unfortunately result sad salvador http t co dcd t vif,  ofahmio yes yes come,  time australian use illridewithyou solidarity muslim sydney siege http t co rt fye akl proud aussie today,,  time hey speak buddy,,,,,,,,,,,,,,,,,,,,,,,,,,,,,,,,,,,,,,,,,,,,,,,,,,,,,,,,,,,,,,,,,,,,,,,,,,,,,,,,,,,,,,,,,,,,,,,,,,,,,,,,,,,,,,,,,,,,,,,,,,,,,,,,,,,,,,,,,,,
australia reaction sydneysiege magnificent http t co lq vjkwrey illridewithyou http t co p khif n,  independent naive australian probably deserve x mas present send troop fight isis terrorist iraq idiot send,  independent reddit link offer request help http t co ygopwwaemt,  independent sign weakness illridewithyou sydneysiege,  independent merica stralia,  independent broomstick love,,  independent nice,,,,,,,,,,,,,,,,,,,,,,,,,,,,,,,,,,,,,,,,,,,,,,,,,,,,,,,,,,,,,,,,,,,,,,,,,,,,,,,,,,,,,,,,,,,,,,,,,,,,,,,,,,,,,,,,,,,,,,,,,,,,,,,,,,,,,,,,,,,,,,,,,,,,,,,,,,,
pray people sydney sydneysiege need peace world sheesh,  tameramowrytwo pray people sydney sydneysiege need peace world sheesh,  tameramowrytwo totally agree pray people hold amp family tear apart senseless death,  tameramowrytwo pray people sydney sydneysiege need peace world sheesh,  tameramowrytwo muslims peace,  tameramowrytwo live min away situation scare hell pray sydneysiege,  tameramowrytwo pinkprint tamera,  tameramowrytwo yessss,  tameramowrytwo like muslim think want peace,  tameramowrytwo peace amp love,,  tameramowrytwo right carry handgun,  tameramowrytwo take side peace preach peace get behead isis destroy,  tameramowrytwo need love,  tameramowrytwo bad hearing happen live happen,  tameramowrytwo aman,,,,,,,,,,,,,,,,,,,,,,,,,,,,,,,,,,,,,,,,,,,,,,,,,,,,,,,,,,,,,,,,,,,,,,,,,,,,,,,,,,,,,,,,,,,,,,,,,,,,,,,,,,,,,,,,,,,,,,,,,,,,,,,,,,,,,,,,,,,,,,,,,,,
sydney attack late th hour people escape gunman demand speak pm isis flag claim bomb amp city,  theschwartz pzfee davidwebbshow gunman get take rest hostage,  theschwartz pzfeed davidwebbshow sorry early report say update,  theschwartz pzfeed davidwebbshow early report say mean,  tricomstorm pzfee davidwebbshow shooter australia place talk,  pzfee davidwebbshow dumbass multiple opportunity kill bastard sniper wtf wrong,,,,,,,,,,,,,,,,,,,,,,,,,,,,,,,,,,,,,,,,,,,,,,,,,,,,,,,,,,,,,,,,,,,,,,,,,,,,,,,,,,,,,,,,,,,,,,,,,,,,,,,,,,,,,,,,,,,,,,,,,,,,,,,,,,,,,,,,,,,,,,,,,,,,,,,,,,,,,
sydneysiege perpetrator target citizen irrespective faith cut anti muslim bigotry twitter,  amroali tarekshoukri oh right doctrine fundamentalist use literal intepretation mean word word,  amroali criticize islam constitute anti muslim bigotry,  amroali perpetrator definitely shia ponder,  legible m khaledbeydoun amroali hezbollah terrorist attack anti muslim bigotry truth report,  tarekshoukri entertain,  khaledbeydoun amroali yes unfortunately bigotry rely rational thinking,  amroali true muslim extremist kill fellow muslim lot,  bubbbyboo amroali starter huge muslim jihadi flag hang terrorist building clue,  amroali lol problem kind exceedingly rare buddhist mormon muslims champion crap,  amroali agree fair bet cafe politely ask religion start,  amroali ' bigotry ' aim terrorist muslim yes disgraceful cunt yes muslim like,  amroali tarekshoukri terrorist idea commit terror religion,  amroali give shit kill muslim enemy,  amroali bigot excuse express voice feel result,  amroali tarekshoukri u conveniently ignore violent text doctrine play victim long suit agenda,  christinaelisha apologist excuse pat shoulder misrepresent situation amp criticize fallacy,  hectorbalderass amroali wait fact know,  legible m khaledbeydoun amroali religion yes rely rational thinking cuz mo fly magic horse,  amroali anti muslim bigotry twitter morning see plenty moral equivalence lefty wanker tho,  amroali suppose ignore perp muslim religion muslim persecution gay woman,  amroali legible m sadly backlash islamophobia social medium ground increase,  hectorbalderass amroali b looney know forget nasty sword turn b plastic,  tarekshoukri blame terrorist,  khaledbeydoun amroali legible m khale islamophobia lose sting call infidel,,,,,,,,,,,,,,,,,,,,,,,,,,,,,,,,,,,,,,,,,,,,,,,,,,,,,,,,,,,,,,,,,,,,,,,,,,,,,,,,,,,,,,,,,,,,,,,,,,,,,,,,,,,,,,,,,,,,,,,,,,,,,,,,,,,,,,,,,,
female hostage appear turn light lindt cafe tonight http t co t quzxsrte sydneysiege http t co p p tylyeo,  beckaa smh totally agree tweet,  smh know tweet picture like,  sugarsprout smh repost think poor woman family delete,  supermario smh glad,  beckaa smh glad hear poor woman die pic post net click wrong,  smh know good idea tweet real time guy,  sharkie smh nswpolice report block post sensitive image suggest u,  smh post nswpolice request,  sugarsprout thank,  olliebluehaven smh yep wrong sure report update want image,  smh adhere police request publicise image,  olliebluehaven smh yep care wanna cash wish nswpolice post pic,  smh matter,  olliebluehaven right sorry delete,  smh pig australian medium joke image awful distasteful report sydneysiege,  smh show face,  sharkie smh nswpolice agree fke shameful post absolute c nt sydney morning herald,  smh surely think okay poor girl face blur website,  smh angle shot sky news indicate police request medium broadcast blur hostage face,  beckaa smh totally agree wonder report twitter police,  smh god bless colleague strong safe pray,  olliebluehaven smh report image contain sensitive image hope police deal medium later date,heartbreaking picture family devastate disguise face privacy smh sydneysiege,,,,,,,,,,,,,,,,,,,,,,,,,,,,,,,,,,,,,,,,,,,,,,,,,,,,,,,,,,,,,,,,,,,,,,,,,,,,,,,,,,,,,,,,,,,,,,,,,,,,,,,,,,,,,,,,,,,,,,,,,,,,,,,,,,,,,,,,,,,
hard sleep tonight know innocent people far fear hour sydneysiege prayforsydney,,,,,,,,,,,,,,,,,,,,,,,,,,,,,,,,,,,,,,,,,,,,,,,,,,,,,,,,,,,,,,,,,,,,,,,,,,,,,,,,,,,,,,,,,,,,,,,,,,,,,,,,,,,,,,,,,,,,,,,,,,,,,,,,,,,,,,,,,,,,,,,,,,,,,,,,,,,,,,,,,,
australian prime minister tony abbott addressing incident sydney watch live cnngo http t co hahu mdtuj,  cnnbrk piece shit arab die,  cnnbrk dio proteja los rehene,  cnnbrk australian prime minister tony abbott addressing incident sydney watch live cnngo http t co tbme cbdq isis,  cnnbrk cover cnn tv,  gyoungquest cnnbrk ho shit know look shirt,  cnnbrk wow figure important good,,  cnnbrk hey feinstein watch,  cnnbrk doubt islamic terrorist pakistani origin,  cnnbrk swat team aboriginal boomerang,  gyoungquest cnnbrk wish arab die look different terrorist act criminal behaivor,  peeyushmalhotra cnnbrk ha ha let find blame pakistan,  cnnbrk australian prime minister tony abbott addressing incident sydney watch live cnngo http t co n niuzrhwe prayingsydney,  gyoungquest nafeh oukba cnnbrk great political commentary killer fashion sense boot love fedora,  cnnbrk australian prime minister tony abbott addressing incident sydney watch live cnngo http t co bucxrfrvty,  cnnbrk http t co yfbhqudvll,  cnnbrk jatirado u r b e s fault,  gyoungquest cnnbrk nation like howeva people like u believe u know,  nafeh oukba cnnbrk yes right hate arab horrible disgusting people,  cnnbrk hostage take islamist incident terrorist need string,rt cnnbrk australian prime minister tony abbott addressing incident sydney watch live cnngo http t co pq phmqrtm,,,,,,,,,,,,,,,,,,,,,,,,,,,,,,,,,,,,,,,,,,,,,,,,,,,,,,,,,,,,,,,,,,,,,,,,,,,,,,,,,,,,,,,,,,,,,,,,,,,,,,,,,,,,,,,,,,,,,,,,,,,,,,,,,,,,,,,,,,,,,
fact religious loner exactly isil aim inspire modus operandi sydneysiege,  bklynmiddleton maajidnawaz real source apart people wild belief islamic caliphate way forward frightening,  londonsonya maajidnawaz muslim murderer,  maajidnawaz help publicize barrett story freebb http t co uixsdffvfx,  maajidnawaz problem solve invite join conservative party,  bklynmiddleton yes absolutely comfortable term self starter early want alternative,  mrobertson maajidnawaz seccie feel free berate noble sentiment nationalism kill way people,  maajidnawaz like mohammed order follower murder people,  maajidnawaz lone operator lone detect pattern,  londonsonya maajidnawaz repeat muslims murderer decency,  bklynmiddleton maajidnawaz good point hopefully turn trend ten hundred individual,  schmittpaula mrobertson maajidnawaz seccie bring harmfulness cocaine defend pcp,  maajidnawaz lone wolf lone wolf follower facebook surely not follow pro rape life,  maajidnawaz seccie problem maajid religious loner continuous stream muslim nut job attack,  schmittpaula maajidnawaz seccie oh word think tear jihad quash fallacy let look communist murder,  bklynmiddleton yes religious lone wolf muslim find support terrorism ' holy book ',  edlofficialpage maajidnawaz head goat ass nawaz islam cult religion god bless uk usa amp australia,  maajidnawaz sydneysiege selfie http t co nfr rlkhjm,  maajidnawaz exactly,  maajidnawaz angry nutter religion excuse,  bklynmiddleton maajidnawaz attack terrifying scenario world deal largely unstoppable,  maajidnawaz true think categorize attack lone wolf inaccurate description,  antonioballista maajidnawaz breathe say muslims billion million murderer idiot,  antonioballista maajidnawaz coran coran muslims different stupid great,  maajidnawaz angry white atheist wish group join brutalise ppl behalf,  maajidnawaz well term,  antonioballista maajidnawaz like mohammed order follower murder people misunderstood don t think,  maajidnawaz seccie indicate fundamentally wrong ideology,  intrinsic schmittpaula mrobertson maajidnawaz seccie maajid penny pinch sensationalist,  londonsonya maajidnawaz repeat muslim murderer,,,,,,,,,,,,,,,,,,,,,,,,,,,,,,,,,,,,,,,,,,,,,,,,,,,,,,,,,,,,,,,,,,,,,,,,,,,,,,,,,,,,,,,,,,,,,,,,,,,,,,,,,,,,,,,,,,,,,,,,,,,,,,,,,,,,,
