source_tweet,favorite_count,retweet_count,reply_1,reply_2,reply_3,reply_4,reply_5,reply_6,reply_7,reply_8,reply_9,reply_10,reply_11,reply_12,reply_13,reply_14,reply_15,reply_16,reply_17,reply_18,reply_19,reply_20,reply_21,reply_22,reply_23,reply_24,reply_25,reply_26,reply_27,reply_28,reply_29,reply_30,reply_31,reply_32,reply_33,reply_34,reply_35,reply_36,reply_37,reply_38,reply_39,reply_40,reply_41,reply_42,reply_43,reply_44,reply_45,reply_46,reply_47,reply_48,reply_49,reply_50,reply_51,reply_52,reply_53,reply_54,Label
#US consulate reportedly evacuated amid #Sydneysiege hostage situation http://t.co/1ZlzKDjvSf #martinplace http://t.co/usVgXibdKO,35.0,106.0,@RT_com @DesireeAaron Evacuating because of these pigs?,@RT_com Im sure #Obama &amp; #Holder would classify the #SydneySiege as #WorkplaceViolence &amp; not #IslamicTerrorism #BanIslam #ImpeachObama #tcot,@RT_com Can't get through to daughter &amp; grand-kids in central Sydney. Just have to hope they're fine.,@RT_com it's show for occupy Syria by US Army under the pretext of ISIS,@RT_com HANDS UP DON'T SHOOT TERRORIST,"@RT_com Of course #Obama is running from the #SydenySiege, he doesn't want 2 interfere with the plans of his #MuslimBrotherhood. #ObamaSucks",@RT_com naw bro ISIS just wanted chocolate lmao.,@Jasperfirst @RT_com I want leadership that will stand against evils like #Islam &amp; serve the people as directed by the people. Obama isnt it,@RT_com the US'll be behind it! 😆 derrr!,"@RT_com still though, any publicity...",@RT_com Im glad we (The US) are sticking around 2 help. #Obama is as chickenshit as they come. That's what #Liberal courage looks like. #Run,@RT_com Don't want another Benghazi! O doesn't want to keep looking like a failure again.,@RT_com soldiers of islam bikers,@RT_com @MutahiNgunyi @OleItumbi @UKenyatta  why does the United States always run away when is friends are attacked? Sidney hotel siege.,"@RT_com Well look at what we have here... ""Diversity"" and ""progress"" in action. Fuck multiculturalism!

#WarOnWhites  #WR",@RT_com I'd rather be shot or beheaded in preference to holding up that abomination of a flag.,@SeanDiVincenzo @RT_com So you want Bush clones back?,,,,,,,,,,,,,,,,,,,,,,,,,,,,,,,,,,,,,,0
Islamic terrorist attack in Sydney. Hostages holding up a black flag with the Islamic creed on it. #SydneySiege http://t.co/8NE4o0coQ6,18.0,120.0,@ivivekbansal @Modiarmy these terrorrists are not islamic they are inhuman being!!,@ivivekbansal @Narendramodi_G Oh but terrorising has nothing to do with religion.Nothing at all.,@ivivekbansal @Modiarmy Hope #Australia beats the shit out of these Islamic Jihadis! @ritzy_jewels,,,,,,,,,,,,,,,,,,,,,,,,,,,,,,,,,,,,,,,,,,,,,,,,,,,,0
BREAKING NEWS: UP TO 50 PEOPLE BEING HELD HOSTAGE IN SYDNEY. 7NEWS,52.0,171.0,@joshuabruin @PzFeed ik that but only 13 ppl what about these other ones,@WI4Palin @PzFeed thanks!,@WI4Palin @PzFeed old news? You have more timely info?,“@PzFeed: BREAKING NEWS: UP TO 50 PEOPLE BEING HELD HOSTAGE IN SYDNEY. 7NEWS” well let them go @syd_lang,“@PzFeed: BREAKING NEWS: UP TO 50 PEOPLE BEING HELD HOSTAGE IN SYDNEY. 7NEWS” @DRUDGE_REPORT,@Liberata017  get http://t.co/l56buQ9O1E,@PzFeed @dahboo7 Did they say there was a black flag with arab writing? ISIS supporter? or soldier?,@Saintsupurdome @PzFeed isis took over a cafe,“@PzFeed: BREAKING NEWS: UP TO 50 PEOPLE BEING HELD HOSTAGE IN SYDNEY. 7NEWS” 😕,@MichaelLFC28 @PzFeed they don't have a clue. 13 to 50 is a big difference,“@Liberata017: @WI4Palin @PzFeed old news? You have more timely info?” Twitter search #Sydney #sydneysiege #sydneycafe,The number keeps growing ??? @PzFeed,"“@PzFeed: BREAKING NEWS: UP TO 50 PEOPLE BEING HELD HOSTAGE IN SYDNEY. 7NEWS”

50 now?",@PzFeed WHAT IS HAPPENING,“@PzFeed: BREAKING NEWS: UP TO 50 PEOPLE BEING HELD HOSTAGE IN SYDNEY. 7NEWS” wtf?,@PzFeed old news,"@PzFeed From 20, to 13, and now 50. What's with the changes?",@WI4Palin I should! You're not the first to recommend it.,,,,,,,,,,,,,,,,,,,,,,,,,,,,,,,,,,,,,0
No word yet on the whereabouts of gunman Man Monis.  #SydneySiege #9News http://t.co/EqqeSpmIHg,50.0,131.0,@9NewsAUS @9NewsSyd hopefully his dead they better drag out his body the sum and show the world we don't tolerate idiots,@9NewsAUS minus a head,@9NewsAUS Hell would be appropriate.,@9NewsAUS @9NewsMelb in hell hopefully,@9NewsAUS what ?,@9NewsAUS his dead obviously,,,,,,,,,,,,,,,,,,,,,,,,,,,,,,,,,,,,,,,,,,,,,,,,,0
Scary scenes in Sydney right now. Thoughts go out to everyone involved. Hopefully the hostage situation can be resolved peacefully.,471.0,125.0,"@QurszaOM @Vikkstar123 Hostage situation in a Cafe, with people at gunpoint",@Vikkstar123 I go to school near the city,@Vikkstar123  Ur so thoughtful Vik! Thanks!,@Vikkstar123 You are like the only youtuber I follow on twitter that has spoke up about the situation #Respect 👊,@Vikkstar123 thank god i live in melbourne,@Vikkstar123 Thanks for support!,@Vikkstar123 such s good guy vikk,@Vikkstar123 Ehm... What happened? :/,@sagedenigma @Vikkstar123 Go help!.,@Vikkstar123 thanks bro,"@Vikkstar123 Lets hope they're safe, new crew aren't making the situation any better.",@vikkstar123 people are saying ISIS are keeping them hostage is it true,@Vikkstar123 a person has been handcuffed,@Vikkstar123 vikk call up ya cousins and tell them to chill in that cafe,@Vikkstar123 thank you vikk for being so thoughtful Even though  it's not happening where you live you still care about what goes on around!,@DareToTaha @Vikkstar123 what the fuck is wrong with you?,@RobertW97_ @Vikkstar123 oh... thanks for the information,@Vikkstar123 thank you for being the first international YouTuber to say this! Praying for all of those there.,@lukewarg @Vikkstar123 I don't think that's the right thing to do in these situations,@Vikkstar123 crazy stuff and to think I'm just over an hour away from it,@Vikkstar123 the stuff that happens here in Australia @LachlanYT you seen what's happening?,,,,,,,,,,,,,,,,,,,,,,,,,,,,,,,,,,0
A bomb detection robot has entered the #MartinPl café. #SydneySiege #9News,35.0,100.0,“@9NewsAUS: A bomb detection robot has entered the #MartinPl café. #SydneySiege #9News”,@9NewsAUS You're coverage today has been phenomenal! Keep it up!,RT @9NewsAUS: A bomb detection robot has entered the #MartinPl café. #SydneySiege #9News,@9NewsAUS @lokeshp07 Show the dog also,,,,,,,,,,,,,,,,,,,,,,,,,,,,,,,,,,,,,,,,,,,,,,,,,,,0
"3 people have come running out of the Lindt cafe building, including a man who looked like a cafe worker. #MartinPlaceSiege #sydneysiege",82.0,180.0,@7NewsSydney @qqqqqq1213 definitely a worker that is the lindt uniform,Some nut. @7NewsSydney @misscherryjones,"#Sydney #Australia
@7NewsSydney: 3 ppl running out of the Lindt cafe building, including a man who looked like a cafe worker. #sydneysiege","@7NewsSydney: 3 people have come running out of the Lindt cafe building, including a man who looked like a cafe worker",@7NewsSydney @Ledgerous,,,,,,,,,,,,,,,,,,,,,,,,,,,,,,,,,,,,,,,,,,,,,,,,,,0
"If I understand Hillary Clinton &amp; Sen Feinstein correctly, 1st step for current Sydney hostage situation is to empathize w the f'n bastards.",91.0,114.0,"@MBCompanyMan 

LOL, that is good. Not actually funny, but you are so right about their stupidity.",@MBCompanyMan make em some coco and have a nice chat... @SenFeinstein is a fucking cunt...#bottomlne,@MBCompanyMan 2nd step: tell the hostage takers exactly what they wont do to stop them,@MBCompanyMan step 2 remind everyone just because the tangos are Isis this isn't Islamic.,@MBCompanyMan @instapundit first try to find out what we did to make them feel so mad &amp; aggrieved that they feel the need to take hostages.,@MBCompanyMan wait I thought was to blame on any YouTube video,@MBCompanyMan Sit down for a chocolate ot two.,@danielwwelsh @MBCompanyMan Obama and  team are still talking about what they may recommend Australia Police do about Terrorists @ Hostages,@MBCompanyMan wrong...ignore it and eventually it'll go away.,@MBCompanyMan i just hope (and suspect) there are many of our folks out there doing this work for us who think and act just like you,"@MBCompanyMan @instapundit bring in ""encounter group force"" to dialog on root causes.",@MBCompanyMan step 2- apologize to them,@MBCompanyMan and then ask really nicely for their cooperation.   Maybe 2 please's in the sentence to show our sincerity,@MBCompanyMan send in the bad asses and send out some dead bad guys!  Center mass MB! Happy Holidays to you and the family.,"@MBCompanyMan @instapundit Come on - sing along ""All we are saying is - give idiocy a chance"". It's ridiculous Mike.",@MBCompanyMan @instapundit yes I think the new handbook  dictates warm coco and a foot rub we need project compassion and build rapport,@MBCompanyMan This political climate has got to really piss you off🇺🇸🇺🇸🇺🇸,And certainly don't use a gun to defend yourself. @MBCompanyMan @instapundit,,,,,,,,,,,,,,,,,,,,,,,,,,,,,,,,,,,,,0
#BREAKING: Police believe the man behind the Sydney siege is Iraninan cleric Man Haron Monis  #sydneysiege,39.0,158.0,@abcnews I not believe the words of nsw police.,@abcnews just a typical Aussie battler by the sounds of it #snipertime #sydneysiege,@abcnews #sydneysiege I can't believe that this guy was not locked up earlier!!! WHY wasn't the police watching him more closely???,"@abcnews Self-proclaimed cleric who is charged with murder, several sexual assaults and sent hate mail to the families of Aussie soldiers.",Put a bullet in his head @abcnews @Kerryepp,@random830 @abcnews   who cares how it's spelled??  filth is filth.,@abcnews Who gives a fuck? Hope he chop off every cracker head in that mutha-phucka!!!! Holla,@abcnews  couldn't you even try to spell it right?,"@abcnews And who is he when he's at home? ...Hmmm, maybe that's his issue.",@abcnews Who?,.@abcnews time to send this Iranian cleric back from where he came a body bag would do just fine #auspol,@AusAtheistJim @abcnews Only thing crackers respect. Is violence!!!!! Dick head!!!!! Holla,“@abcnews: #BREAKING: Police believe the man behind the Sydney siege is Iraninan cleric Man Haron Monis  #sydneysiege”,@abcnews converted http://t.co/7aPEL5j7Dj #sydneysiege,@AusAtheistJim @abcnews Ooooop's!!!!! Lol,@sophiescranton no miss perfect he was a murderer and had no right,@abcnews http://t.co/ofC9KMkGUJ,"@paddypsb Yes, he had no right, I'd agree entirely. Your wording was vulgar.",“@abcnews: #BREAKING: Police believe the man behind the Sydney siege is Iraninan cleric Man Haron Monis  #sydneysiege”,@abcnews and again media asked not to name him #Sydney,"@paddypsb good one, Dickhead.","@KeresPerse @abcnews  you're absolutely right, I'm just a grammar grump this time of night",@McMillianJm @abcnews fucks wrong with you cunt?,,,,,,,,,,,,,,,,,,,,,,,,,,,,,,,,0
Police surrounding cafe in central Sydney after reports of hostages being taken,42.0,298.0,@GreenieC Nope safe at work Mrs G! Not far from here though!! 😳,“@SkyNewsBreak: Police surrounding cafe in central Sydney after reports of hostages being taken” rubber dingy rapids,@SkyNewsBreak 'Shahada' flag is the flag on display.,“@SkyNewsBreak: Police surrounding cafe in central Sydney after reports of hostages being taken”,@HannahC19 cunt,“@SkyNewsBreak: Police surrounding cafe in central Sydney after reports of hostages being taken” @Hannah_Dornan 😱,@Kerry_Rad ooooh Radders! Nothing like dramas on your last few days... Have a safe flight home &amp; I hope you &amp; the fam have a great crimbo xx,@SkyNewsBreak Any one read Arabic script? what's on the flag?!?,@SkyNewsBreak @CarlyJay20 just some scousers nicking hubcaps !! Don't panic,“@SkyNewsBreak: Police surrounding cafe in central Sydney after reports of hostages being taken” you're not in there are you @Kerry_Rad ? 😳😁,@AshhUtb I'm joking sugar tits x,@GreenieC thank you Mrs G and you! 🎅🎄❄️ xxx,@AshhUtb gonna nick this cause I'll get bare RTS,"@Chrisrhodespoke @SkyNewsBreak Yep, guessed that but the flag looks different to the ones seen before. Helpful to get translation though",@SkyNewsBreak was the food really that bad ????,@cocteau501 @SkyNewsBreak sounds like the isis are involved,“Police surrounding cafe in central Sydney after reports of hostages being taken” rt@SkyNewsBreak,@SkyNewsBreak Really shit coffee apparently....,,,,,,,,,,,,,,,,,,,,,,,,,,,,,,,,,,,,,0
Police aware that hostages are posting gunman's demands on social media. #sydneysiege,30.0,107.0,@SkyNewsAust I'm not - are you? #sydneysiege,@SkyNewsAust what else could they do?😩,Via @SkyNewsAust: Police aware that hostages are posting gunman's demands on social media. #sydneysiege”  @dahboo7,"@SkyNewsAust The Mutant Muslims strike again on social media.
They are winning on all fronts as @BarackObama is still stuck on policy.",@SkyNewsAust @ChrisCopywriter #GetWise #QLDer P.S. I'm from Sydney,"@SkyNewsAust Did you just call the terrorist a gentleman? That really gets my back up, couldnt be furthest from the truth",“@SkyNewsAust: Police aware that hostages are posting gunman's demands on social media. #sydneysiege”,,,,,,,,,,,,,,,,,,,,,,,,,,,,,,,,,,,,,,,,,,,,,,,,0
"UPDATE: Hostages fleeing #Sydney cafe held by Iranian gunman as explosions, gunshots are heard: http://t.co/WrPVZSJHlX",45.0,142.0,"@FoxNews  Was he saying ""hands up don't shoot""? Police overreaction? People are glad the police are there when they are in trouble.",@FoxNews Looks like it's over.,@FoxNews If only we could have got a sniper rifle aimed on his head idiots just don't know how to make things much better.,@FoxNews religion of peace.,@FoxNews any update on PA shooting?,@FoxNews I hope the customers get free chocolate for life because of this spineless thugs actions.,@FoxNews I hope they kill him,@FoxNews Hopefully they turned him into swiss cheese.,@FoxNews - Just think if they allowed their people to carry guns. He would have been dead 5 minutes after taking hostages.  #GunsSaveLives,@Bernhardtbeach doesn't seem like it. But people are resilient &amp; again will get through this. #Sydneyseige,@FoxNews  More work place violence!,@FoxNews Let's Go #Aussies! Send that dude to #HELL,@anjalisidebar is it safe anywhere?,"“@FoxNews: Hostages fleeing #Sydney cafe held by Iranian gunman as explosions, gunshots are heard: http://t.co/NSv8EBl6AC” #TurningPoint",,,,,,,,,,,,,,,,,,,,,,,,,,,,,,,,,,,,,,,,,0
Hostages are posting the requests of the gunman on social media. @nswpolice has asked the media not to publish those requests #SydneySiege,51.0,148.0,"@mariajohnson77 @em_partridge @smh @nswpolice my issue is police having control over what is broadcast, this is a dangerous precedent! Shame",@blastedsilver @em_partridge And for a very good reason! Really disturbing actually... #sydneysiege,"@firefly_rfs @mariajohnson77 @em_partridge @smh @nswpolice true, but it is necessary in emergencies like this.","@em_partridge @BevForte @nswpolice Let me guess, the filthy Muzzie terrorist wants 72 virgin goats to fuck or else?",@em_partridge @smh @nswpolice unfortunately hasn't stopped The Straits Times,@firefly_rfs @em_partridge @smh @nswpolice true but I guess it's such an unknown you don't know what is best,@blastedsilver @em_partridge if anyone has links and stuff please don't share or post,@em_partridge @smh @nswpolice censorship is not the answer people have a right to know!!,@firefly_rfs @em_partridge @smh @nswpolice I think the intention is to protect the hostages,“@em_partridge: Hostages posting the requests of the gunman on social media. Police asked media not to publish those requests #SydneySiege,@blastedsilver @em_partridge why are we so worried about offending these people they don't care about us..,@em_partridge @smh @nswpolice well they are contacting media not social media there is a big difference,@em_partridge @nswpolice @smh Not if it harms the hostages,,,,,,,,,,,,,,,,,,,,,,,,,,,,,,,,,,,,,,,,,,0
Update: Five hostages escape as a gunman continues siege in Sydney cafe http://t.co/srN4LP5972 http://t.co/JRXqBzBVEH,86.0,168.0,Is it escaped or released? Appreciate some clarity on that. @NBCNews,“@NBCNews: Update: Five hostages escape as a gunman continues siege in Sydney cafe http://t.co/d0Qxdwmd27 http://t.co/p9glWzVC9J”,"@NBCNews i had some very, helpful wonderful policemen ...that helped me when the car broke-down

Good to kniw","@SMoKeeGyRL @NBCNews Umm it's Twitter. I will ""sarcasm"" all I want to. Because freedom. Or some shit.",@NBCNews Bless her!,"@JHolmsted @SMoKeeGyRL @NBCNews Didn't occur to me that it might not be sarcasm. Was obvious, I thought. The lady has been through hell.",@NBCNews Bastard cops. How dare they help her.,"@SMoKeeGyRL @NBCNews Also, it's ""THERE are bad ones"" &amp; ""just like there ARE bad humans"" #spellcheck #grammar",@DAJSamarasinghe its NBC......,“@NBCNews: Update: Five hostages escape as a gunman continues siege in Sydney cafe http://t.co/21vu2rTNBL http://t.co/LEz8khSaN4” epidemic,"How scary. ""@NBCNews: Update: Five hostages escape as a gunman continues siege in Sydney cafe http://t.co/CsAMmED3Gb http://t.co/lkRfEjYaWe”",@NBCNews thanks God they escape,@JHolmsted @NBCNews Not all cops are bad.. Their are bad ones just like there is bad humans out there carrying guns legally. stop w/sarcasm.,@NBCNews @KING5Seattle this is sad news.,,,,,,,,,,,,,,,,,,,,,,,,,,,,,,,,,,,,,,,,,0
"CONFIRMED: Three hostages, 2 customers, 1 worker, have been released from Cafe. #sydneysiege",91.0,134.0,@TheAnonMessage released or escaped?,"@TheAnonMessage http://t.co/QmgulquObV STOP THE VIOLENCE BY &amp; AGAINST YOUTH, POLICE &amp; ALL OTHERS! http://t.co/OXYD5vwsYF",,,,,,,,,,,,,,,,,,,,,,,,,,,,,,,,,,,,,,,,,,,,,,,,,,,,,0
"With the #sydneysiege now in its tenth hour, police say they're in contact with the gunman. http://t.co/Au4T7dsSAh http://t.co/KQftolnHji",82.0,207.0,@SkyNews Shoot him and interrogate him .,@SkyNews,@SkyNews Great pic.,@SkyNews how about referring to him as an Islamic terrorist and not a gunman? Speak the truth for once! Radical Islam is Poison,@SkyNews I'm thinking same as Simon,@SkyNews I bet there in contact arranging how much there all gonna get so why is he actually holding them hostage can you answer that,@philipe20 oh!,@SkyNews hhhhhh,“@SkyNews: With the #sydneysiege now in its tenth hour http://t.co/s53yM5rLSF” spotted @SarahHDean,,,,,,,,,,,,,,,,,,,,,,,,,,,,,,,,,,,,,,,,,,,,,,0
"Martin Place, Sydney Opera House &amp; State Library evacuated due to #sydneysiege follow our blog
http://t.co/4MUc9ivwbK http://t.co/s6hCQ8QOAs",32.0,108.0,@alixsk28 @abcnews and expect more of this now that Ozero has given the green light.,Thanks @abcnews for pic of Martin place. It shows how #sydneysiege is crowded with onlookers. In real war places like Syria crowds scatter..,"@abcnews should all people give hand to Kurdish Peshmarga to finish of ISIS 
Long live Australia &amp; long live Kurdistan free","@abcnews Me, I would not be standing around in a crowd in Sydney right now. #sydneysiege","“@abcnews: Martin Place, Sydney Opera House &amp; State Library evacuated due to  @LJCambria 
http://t.co/DxeH92kVRE http://t.co/LGIgdZVYQm”",@abcnews @abcnewsSydney Seriously people follow directions and evacuate the area. That include dumbass spectators. Give the authorities room,@abcnews this person has a message but what to do this kind of act!,@abcnews oh...no....please save those hostages ....,"MT @abcnews: Martin Place, Sydney Opera House &amp; State Library evacuated due to #sydneysiege 
http://t.co/05aFiwRE9v http://t.co/fyfKtWS7jq",@abcnews this is my opinion he wants to convey a msg,@kathyrice15 @abcnews See https://t.co/MFOsuu6Hox - they using a hostage to get that message to the media and bypassing the police?,"@abcnews look at the Vultures, how about leaving the police to do their job and stop giving that moron his ""Fame"" #MoveAlongFools",@kathyrice15 @abcnews No idea.  Not a listener.,@TimKofCanberra @abcnews what are they saying?,,,,,,,,,,,,,,,,,,,,,,,,,,,,,,,,,,,,,,,,,0
BREAKING: Five have now escaped a hostage situation at a cafe in downtown Sydney #sydneysiege http://t.co/gl30dy8PYN http://t.co/7oYbXnAeKV,86.0,197.0,,,,,,,,,,,,,,,,,,,,,,,,,,,,,,,,,,,,,,,,,,,,,,,,,,,,,,,0
"Hostages held in Sydney cafe, forced to hold Islamic flag in window: http://t.co/UiqFQ372Ae http://t.co/LDeKQuLYcx",171.0,732.0,@Reuters  this is the result of financing these criminals that use the relegion to achieve political aims,@chaoukiajami @Reuters this is the result of religious fundamentalism. Period.,@Reuters The damage done by Obama to appease communists will be irreversible. We have to stop this now or our nation will collapse,"“@Reuters: Hostages held in Sydney cafe, forced to hold Islamic flag in window: http://t.co/oISl2pFZYa http://t.co/oOwN7rWaRZ”",@JDMoss is that mosquito fucking with me? Typical of a blood sucker. Bye conceded liberal. Only if you could survive without my tax dollars.,@JDMoss @Reuters How clever. The tolerance of a conceded idiot. Is this spelled correctly: fuck you.,"@JDMoss @Reuters and as a good liberal, spell check may be the only thing you operate.",@plkarter @Reuters that isn't how you spell conceited. But I guess spelling it wrong twice means you are too dumb to operate spell check too,"Uh oh. RT @Reuters: Hostages held in Sydney cafe, forced to hold Islamic flag in window: http://t.co/my4l9GVZE1 http://t.co/z5vMJ9CM7I",@JDMoss @Reuters We are their enemy. Eventually they all get together for their supremacy. You just another conceded idiot.,"@plkarter @Reuters you do not know anything about my politics, and certainly don't understand them well enough to use any labels.",@GoodDayPayday amen brother,@Reuters I'd wipe my ass with that flag,@mukhtaryare @OzzyForMayor @Reuters What??? Why r they in Sidney??? Send them home with all that bullshit. No ones interested in that.,"@Reuters 

Katy &amp; Bieber embrace Islam: http://t.co/5aZF6v6kxT

The Bible &amp; NASA embrace Islam: http://t.co/KL7Pm8FQcT,","@plkarter I live in China, I essentially own you. Let that sink in while you watch Fox and Friends later today...",@plkarter the name of the application is Twitter.,"@plkarter @Reuters no, just not afraid of idiots and fundamentalists. If you want to try and make your point, at least learn to spell.",@Reuters Do the leftist Democrats in charge of the Party realize the danger Iran poses with Nuclear weapons? These animals will destroy us,@JDMoss Some of us have to work and tweeter is just pastime activity. I'm glad you have shown your tolerance for the new Obama's immigrants.,.@Reuters @SeeTac7 thank goodness it wasn't an Uber flag. That would have elicited worldwide outrage.,"“@Reuters: Hostages held in Sydney cafe, forced to hold Islamic flag in window: http://t.co/eRqmI3medF http://t.co/KhiT8Mb25Q”",@JDMoss I am not a gullible Democrat &amp; fully realize it. I sleep well assured that is being done by your comrades here &amp; they will fail,"Hostages held in Sydney cafe, forced to hold Islamic flag in window: http://t.co/azW9Zhwf9n via @Reuters","What's ""Islamic flag?"" RT @Reuters: Hostages held in Sydney cafe, forced to hold Islamic flag in window: http://t.co/0LqtkSh0ud","@plkarter it is a really clear indication of ones intelligence, when the only option is to create positions you imagine your detractors have","Hey, @Reuters, what is an ""Islamic"" flag ? If you don't know what you're talking about, better not report @PabloDiez_ABC","@plkarter @Reuters islamic state and most islamic terrorists are Sunni, Iran is Shia. They are enemies. Get educated.",@PeterLawrey Thanks for telling me you conceded gullible liberal. Do you think this garbage is looking for Australians? You &amp; me. F off,@Reuters I've been REALLY praying 4 them most of the evening.  Please join me &amp; do the same!  Freaking terrifying 2 worry about your life!,@plkarter you do realise that Sydney is in Australia which has a *Conservative* national government who are members of the Liberal Party.,"ISIS ? OMG @Reuters: Hostages held in Sydney cafe, forced to hold Islamic flag in window: http://t.co/g4ZnpfT8J1 http://t.co/vU8sOQGwJP”",@JDMoss,@ToucanSam87 only after emptying my clip on these m_____r f_____s.,,,,,,,,,,,,,,,,,,,,,0
BREAKING ALERT: Preliminary reports indicate perpetrators appear to be members of #ISIS. #SydneySiege,30.0,117.0,@designnotdrum @TheAnonMessage Just read some Aussie news report so NOT spreading rumors. Grow up Nick.,"@TheAnonMessage not Isis, another group","@designnotdrum @JSchoenberger7 @TheAnonMessage Agreed, I have been pointing this out btw ;)",@JSchoenberger7 @TheAnonMessage not an Isis flag. Just an Islamic one. Stop spreading false rumors.,@KTH473 @JSchoenberger7 @TheAnonMessage What if it's Lone wolf? Immediately giving credit without fact checking favors them.,"@JSchoenberger7 @TheAnonMessage Interesting, because the Guardian says different. http://t.co/mwe9CcLxoE",@TheAnonMessage ISIS flag supposedly put in window.,“@TheAnonMessage: BREAKING ALERT: Preliminary reports indicate perpetrators appear to be members of #ISIS. #SydneySiege” well this is good,@designnotdrum @JSchoenberger7 @TheAnonMessage Shahada on a black flag is a general Jihad flag that Al Qaeda/Al Nusra etc.. use.,“@TheAnonMessage: BREAKING ALERT: Preliminary reports indicate perpetrators appear to be members of #ISIS. #SydneySiege” wonderful.,@designnotdrum @JSchoenberger7 @TheAnonMessage Does it actually matter?,@KTH473 @JSchoenberger7 @TheAnonMessage Sure. But to link to ISIS is factually inaccurate and irresponsible.,@TheAnonMessage no.,"@JSchoenberger7 @TheAnonMessage The Shahada is not a ""group."" http://t.co/NtmkHzKMTx Basic googling skills help. Misinfo doesn't.",,,,,,,,,,,,,,,,,,,,,,,,,,,,,,,,,,,,,,,,,0
