"#SydneySiege is likely being carried out by a 'lone wolf' with minimal links to organized terror groups, expert says http://t.co/ynPfmQfGMj",80.0,202.0,"@WSJ been too many ""lone wolves"" lately.",@PsychicWaugh @WSJ @DanielStacey Two Canadian soldiers were murdered in Canada in November by lonewolf Jihadists. It's not either/or.,"@WSJ Looks like a wannabe, has wrong flag ( probably from the markets ) and wants Aus Police to get him the right flag - moron.",@WSJ @DanielStacey more hostages.,@WSJ @DanielStacey Apparently being a coreligionist is all the link that is required. Time to explore that connection for terror prevention,"@WSJ Lots of ""lone wolves"" lately, though, eh?  Doesn't sound all that lone wolf to me. Keeps happening everywhere.",@WSJ @DanielStacey So the narrative begins #sydneysiege What say you? #PJNET #tpp #tcot,@WSJ Damn - does that mean we can't go into a massive over reaction here in Australia? Never mind - we'll find a link somehow...,"@WSJ @tmurphyNZH thats what I thought, if a terrorist they would of blown themselves up by now..this guy is probably scared as,a twit",@WSJ Uh huh.,"Did he write the book ""Hostage Terrorist, Terrorist Hostage""? @WSJ",@WSJ @DanielStacey he wants publicity thats it... Just shoot the SOB,"@WSJ Yes. Has hallmarks of a deluded loner. The call on the flag is telling. V scary, such irrationality.",@WSJ http://t.co/5oNUGW9oWV Dirty #secret NOT mentioned- #tracking innocent civilians w/ #cancer causing radar. West coast too! Ban!!!,@WSJ lone wolf? why not call out as it is? Islamic terrorist!!!,“@WSJ: #SydneySiege is likely being carried out by a 'lone wolf' with minimal links to organized terror groups http://t.co/5Ftx50jDq9”,@WSJ Does it help &amp; make one feel better?  It's a terror attack nonetheless,@WSJ @YusufDFI witness said he was threatened by 2 jihadis - is msm again afraid to name,"@WSJ @ColorMeRed 
Then further minimalisze the risk by taking him OUT!!",@WSJ @DanielStacey though apparently he is an Isis advocate and supporter or why else would he made demands for their flag to release,,,,,,,,,,,,,,,,,,,,,,,,,,,,,,,,,,,,,,,,,,,,,,,,,,,,,,,,,,,,,,,,,,,,,,,,,,,,,,,,,,,,,,,,,,,,,,,,,,,,,,,,,,,,,,,,,,,,,,,,,,,,,,,,,,,,,,,,,,,,,,,1
Sydney siege ends as police storm Lindt Cafe and hostages run out http://t.co/ek1EyHbJxA,18.0,100.0,"@guardian mới nhất like, share nha ĐIỀU HÒA TỦ ĐỨNG LG http://t.co/1kmGIzuzVT",@guardian and what are you lot worried about the Muslims,@guardian #illridewithyou,,,,,,,,,,,,,,,,,,,,,,,,,,,,,,,,,,,,,,,,,,,,,,,,,,,,,,,,,,,,,,,,,,,,,,,,,,,,,,,,,,,,,,,,,,,,,,,,,,,,,,,,,,,,,,,,,,,,,,,,,,,,,,,,,,,,,,,,,,,,,,,,,,,,,,,,,,,,,,,,1
Australians use #IllRideWithYou hashtag in solidarity with Muslims during Sydney siege http://t.co/5h3kWfwnyL,235.0,480.0,@ensteiners + I wish OZ people had shown solidarity with Jewish population too last summer http://t.co/6lCJ3kuc3S but that's another story,@DaphnaDreifuss they did! I did! That's my local school... I'm Jewish. Happy Chanukah.,@ensteiners Heard different accounts but good to hear there was support too. Happy Chanukah to you too &amp;may #sydneysiege end soon&amp;peacefully,"@TIME I can hear the laughter in the background, accompanied by comment:"" What a bunch of gullible suckers"".","Thats true Patriots RT""@TIME: Australians use #IllRideWithYou hashtag in solidarity with Muslims during Sydney siege http://t.co/taEhvKj23v",@TIME what about the damn hostages?,@TIME @my_rizaniya  God is great.,"@TIME Aussies, you are one classy people.","Thats true Patriots""@TIME: Australians use #IllRideWithYou hashtag in solidarity with Muslims during Sydney siege http://t.co/taEhvKj23v""","@TIME nice gesture, but for now shouldn't we primarily show solidarity with the hostages and worry about everything else later? #sydneysiege",@TIME No,"@DaphnaDreifuss Cant speak for TIME, but here in Sydney, we won't let hatred win &amp; are taking care of the safety of vulnerable ppl.","@TIME wait, what??? What about the people being held at gun point in the freakin coffee shop?",@TIME i thought its hostages who need solidarity,@kavita_jade @TIME Me too!!!,"@TIME The taking of hostages by any situation is an abuse of the freedom of others; God allows no increase racial and religious issues, SAG","@ensteiners and that's wonderful, don't get me wrong. but the hostages are actually in grave danger, so i feel we should focus on them.",@TIME a lot of cowardly ppl about,"@TIME Thanks @kneelandsan , it's very important respect for others, unfortunately the results were sad, Salvador, http://t.co/dcD9t7vIFS","@ofahmio Yes, yes we are! C'mon over!",“@TIME: Australians use #IllRideWithYou in solidarity with Muslims during Sydney siege http://t.co/rt0fyE9AKl” So proud to be Aussie today!,@ensteiners Already there!,"@TIME Hey! Speak for yourself, buddy!",,,,,,,,,,,,,,,,,,,,,,,,,,,,,,,,,,,,,,,,,,,,,,,,,,,,,,,,,,,,,,,,,,,,,,,,,,,,,,,,,,,,,,,,,,,,,,,,,,,,,,,,,,,,,,,,,,,,,,,,,,,,,,,,,,,,,,,,,,,,1
Australia's reaction to the #sydneysiege is magnificent http://t.co/Lq0VjkWreY #illridewithyou http://t.co/p50KHIf47N,95.0,184.0,@Independent:Naive Australians Probably Deserve such a X-mas Present!Should not send Troops 2 fight ISIS Terrorists in Iraq!Idiots send them,@Independent Reddit link to offer and request help http://t.co/YGopWwaemt,@Independent I just see this as what it is: a sign of weakness. #illridewithyou #sydneysiege,@Independent #Merica = #Stralia,@Independent @broomstick33 Love it.,@Independent,@Independent nice,,,,,,,,,,,,,,,,,,,,,,,,,,,,,,,,,,,,,,,,,,,,,,,,,,,,,,,,,,,,,,,,,,,,,,,,,,,,,,,,,,,,,,,,,,,,,,,,,,,,,,,,,,,,,,,,,,,,,,,,,,,,,,,,,,,,,,,,,,,,,,,,,,,,,,,,,,,,1
Praying for the people of Sydney #sydneysiege  All we need is peace in this world. Sheesh.,401.0,298.0,“@TameraMowryTwo: Praying for the people of Sydney #sydneysiege  All we need is peace in this world. Sheesh.”,@TameraMowryTwo totally agree; praying for all people being held against their will &amp; families being torn apart from senseless deaths.,“@TameraMowryTwo: Praying for the people of Sydney #sydneysiege  All we need is peace in this world. Sheesh.”,@TameraMowryTwo Muslims will never be at peace,"@TameraMowryTwo living only 15mins away from this situation, is scaring the hell out of me. Pray for us #sydneysiege",@TameraMowryTwo The pinkprint Tamera!,@TameraMowryTwo yessss!!,@TameraMowryTwo Seems like Muslims... I think they want peace?,@TameraMowryTwo peace &amp; love.,@TameraMowryTwo 🙏🙏🙏🙏,@TameraMowryTwo - and the right to carry handguns,@TameraMowryTwo -it takes 2 sides for peace. The side that preaches peace gets beheaded . Isis must be destroyed,@TameraMowryTwo all we need is love!,@TameraMowryTwo it is bad hearing this happens more so when you live where it is happening,@TameraMowryTwo amen,,,,,,,,,,,,,,,,,,,,,,,,,,,,,,,,,,,,,,,,,,,,,,,,,,,,,,,,,,,,,,,,,,,,,,,,,,,,,,,,,,,,,,,,,,,,,,,,,,,,,,,,,,,,,,,,,,,,,,,,,,,,,,,,,,,,,,,,,,,,,,,,,,,,1
"SYDNEY ATTACK LATEST:
- 16th hour
- 5 people escaped

GUNMAN DEMANDS:
- Speak to PM
- ISIS flag

Claims he has 2 bombs with him &amp; 2 in city",52.0,125.0,@TheSchwartz65 @PzFeed @davidwebbshow there's 2 gunmen if one gets taken out the other will take out the rest of the hostages,@TheSchwartz65 @PzFeed @davidwebbshow I'm sorry early reports said 1 but I wasn't updated,@TheSchwartz65 @PzFeed @davidwebbshow early reports said 2 i meant,@TriComStorm @PzFeed @davidwebbshow one shooter in Australia. Only place I was talking about.,@PzFeed @davidwebbshow dumbasses have had multiple opportunities to kill the bastard with a sniper. WTF wrong with them?,,,,,,,,,,,,,,,,,,,,,,,,,,,,,,,,,,,,,,,,,,,,,,,,,,,,,,,,,,,,,,,,,,,,,,,,,,,,,,,,,,,,,,,,,,,,,,,,,,,,,,,,,,,,,,,,,,,,,,,,,,,,,,,,,,,,,,,,,,,,,,,,,,,,,,,,,,,,,,1
"The #SydneySiege perpetrators target all citizens, irrespective of their faith. So please cut it out with the anti-Muslim bigotry on Twitter",84.0,100.0,@_amroali @TarekShoukri Oh right. The doctrine. We call them fundamentalist who uses literal intepretation. That means word for word,@_amroali criticizing Islam constitutes anti-Muslim bigotry?,@_amroali perpetrator definitely not a Shia.  Ponder that now.,@Legible_M @KhaledBeydoun @_amroali Hezbollah is behind this terrorist attack Is that anti-Muslim bigotry or truth in reporting?,@TarekShoukri  and I'm not entertaining them either,@KhaledBeydoun @_amroali Yes unfortunately such bigotry doesn't really rely on rational thinking.,@_amroali That's true. Muslim extremists kill their fellow Muslims a lot.,"@Bubbbyboo @_amroali well for starters there is a huge muslim jihadi flag hung by the terrorists in front of the building, is it a clue?","@_amroali LOL Well, problems of this kind are exceedingly rare with Buddhists or Mormons. Muslims seem to be the #1 champions at this crap..",@_amroali Agreed! It seems a fair bet that they didn't go around the cafe politely asking which religion everyone was before they started.,@_amroali The 'bigotry' is aimed at the terrorists. Are they Muslim? Yes. Are they disgraceful cunts? Yes. Are all Muslims like that? No,@_amroali @TarekShoukri And where do these terrorists get the idea that they can commit terror in the name of religion?,"@_amroali Who gives a shit, kill these @Muslims as the enemy they are!",@_amroali Bigots now have an excuse to express and voice how they really feel as a result of this.,@_amroali @TarekShoukri So it seems that u conveniently ignore violent text in the doctrine and play victim as long as it suits your agenda,"@ChristinaElisha And apologists now have an excuse to pat themselves on the shoulder, misrepresent the situation &amp; criticizing it. #Fallacy",@hectorbalderass @_amroali Why not wait until facts are known?,"@Legible_M @KhaledBeydoun @_amroali but religion itself, yes that relies on rational thinking, cuz mo flew on a magic horse...",@_amroali what anti-muslim bigotry? I've been on Twitter all morning and haven't seen it. Plenty of moral equivalence lefty wankers tho,"@_amroali are we just supposed to ignore that the perps are muslims doing it for their religion? how about muslim persecution of gays,women?","@_amroali @Legible_M Sadly, the backlash and Islamophobia - on social media and on the ground - will only increase.",@hectorbalderass @_amroali Could b looney? I don't know. Have you forgotten about nasty sword that turned out 2 b plastic?,"@TarekShoukri if there is anyone I'm blaming here, it is the terrorists. No one else.","@KhaledBeydoun @_amroali @Legible_M Khaled, Islamophobia loses its sting when you have been called and infidel.",,,,,,,,,,,,,,,,,,,,,,,,,,,,,,,,,,,,,,,,,,,,,,,,,,,,,,,,,,,,,,,,,,,,,,,,,,,,,,,,,,,,,,,,,,,,,,,,,,,,,,,,,,,,,,,,,,,,,,,,,,,,,,,,,,,,,,,,,,,1
Female hostage appears to turn off the lights at the Lindt Cafe tonight. http://t.co/T6qUZxSrTe #sydneysiege http://t.co/p0p9TYLyeO,74.0,121.0,@Beckaa_92 @smh totally agree as you can see from my last tweet,@smh You know not to tweet pictures like this.,@sugarsprout @smh don't repost this. Think of poor woman's family. Delete please,@supermario200 @smh Glad it's not just me...,@Beckaa_92 @smh glad to hear. If that poor woman dies and her pics were posted on the net for clicks.... That's WRONG,@smh Don't know that it's a good idea to be tweeting all this in real time guys....,@sharkies80 @smh @nswpolice I JUST REPORTED IT TO BE BLOCKED FOR POSTING A SENSITIVE IMAGE I SUGGEST U DO THE SAME,@smh WHY ARE YOU POSTING THIS AGAINST @nswpolice REQUESTS???,@sugarsprout thanks :),"@OllieBlueHaven @smh yep! What's wrong with them?! :( sure report updates, but no one wants to see these images..",@smh Can you please adhere to police requests not to publicise these images.,"@OllieBlueHaven @smh yep! They don't care though, they just wanna cash in on this. And go against the wishes of @nswpolice  to not post pics",@smh Why does it matter?,"@OllieBlueHaven, you're right, sorry, deleted now","@smh you pigs!!! Australian media are a joke!!! Take this image down NOW. It's awful. And so distasteful. 
#reported #sydneysiege",@smh you shouldn't be showing faces!,"@sharkies80 @smh @nswpolice agreed, so fking shameful to post this. absolute c*nts at sydney morning herald.",@smh surely you don't think it's okay to show this poor girl's face here just because you blurred it out on your website?!?!,.@smh is this the angle of shots sky news indicated that police have requested media not to broadcast. Could've blurred the hostage's face!,@Beckaa_92 @smh totally agree. Wonder if it can be reported to Twitter or police?,"@smh God bless her, keep her and colleagues strong and safe. Praying for them all.",@OllieBlueHaven @smh I've reported all their images containing sensitive images. I hope the police deal with the media at a later date..,"This such a heartbreaking picture ,her family must be devastated .Couldn't you have disguised her face for their privacy? @smh #sydneysiege",,,,,,,,,,,,,,,,,,,,,,,,,,,,,,,,,,,,,,,,,,,,,,,,,,,,,,,,,,,,,,,,,,,,,,,,,,,,,,,,,,,,,,,,,,,,,,,,,,,,,,,,,,,,,,,,,,,,,,,,,,,,,,,,,,,,,,,,,,,,1
it'll be hard sleeping tonight knowing innocent people not far from me have been in fear for over 11 hours #sydneysiege #PrayForSydney,68.0,102.0,,,,,,,,,,,,,,,,,,,,,,,,,,,,,,,,,,,,,,,,,,,,,,,,,,,,,,,,,,,,,,,,,,,,,,,,,,,,,,,,,,,,,,,,,,,,,,,,,,,,,,,,,,,,,,,,,,,,,,,,,,,,,,,,,,,,,,,,,,,,,,,,,,,,,,,,,,,,,,,,,,,1
Australian Prime Minister Tony Abbott addressing incident in Sydney. Watch live on CNNgo. http://t.co/HAhU3MDTUj,206.0,332.0,@cnnbrk piece of shit Arabs! Should all die,@cnnbrk Dios proteja a los rehenes,"""@cnnbrk Australian Prime Minister Tony Abbott addressing incident in Sydney. Watch live on CNNgo. http://t.co/TBme3cbDq4"" ¿#ISIS?",@cnnbrk why would this not be covered on CNN TV?,"@gyoungquest @cnnbrk  ho is shit, you know very well, look under your shirt.",@cnnbrk wow you figured out its important now good for you,@cnnbrk,"@cnnbrk Hey Feinstein, you watching?","@cnnbrk 
I doubt these Islamic terrorists are of Pakistani origin",@cnnbrk WHERE IS YOUR SWAT TEAM MADE UP OF ABORIGINALS WITH BOOMERANGS?,"@gyoungquest @cnnbrk  your wish's that all arab must be die! Doesn't look different on these Terrorist, whose Acting by Criminal behaivor..","@peeyushmalhotra @cnnbrk Ha Ha, lets find first. Don't blame Pakistan.",“@cnnbrk: Australian Prime Minister Tony Abbott addressing incident in Sydney. Watch live on CNNgo. http://t.co/n6niuzrHWe”#prayingSydney,@gyoungquest @nafeh_oukba @cnnbrk Great political commentary and a killer fashion sense to boot! Love the fedora!,“@cnnbrk: Australian Prime Minister Tony Abbott addressing incident in Sydney. Watch live on CNNgo. http://t.co/buCXRFrvty”,@cnnbrk  برنامج مخصص لأجهزة أندرويد يستطيع تحديد موقع سيارتك  http://t.co/YfBHqUDvlL ع - ز2568,@cnnbrk @jatirado U R I B E ´S    FAULT,"@gyoungquest @cnnbrk  it's up to you,to call a nation like that, howeva! The people are like U very few! But believe me, U know nothing!",@nafeh_oukba @cnnbrk yes your right! I hate all Arabs! They are horrible and disgusting people,"@cnnbrk hostages taken by Islamists is not an ""Incident"". It's terrorists that need strung up.",RT“@cnnbrk: Australian Prime Minister Tony Abbott addressing incident in Sydney. Watch live on CNNgo. http://t.co/pQ5PHmqrTM”,,,,,,,,,,,,,,,,,,,,,,,,,,,,,,,,,,,,,,,,,,,,,,,,,,,,,,,,,,,,,,,,,,,,,,,,,,,,,,,,,,,,,,,,,,,,,,,,,,,,,,,,,,,,,,,,,,,,,,,,,,,,,,,,,,,,,,,,,,,,,,1
"The fact that ""any religious loner could do this"" is exactly what ISIL aims to inspire, it's their modus operandi #SydneySiege",76.0,113.0,@BklynMiddleton @MaajidNawaz no real source apart from people's wild belief that an Islamic caliphate is the way forward. frightening.,@LondonSonya @MaajidNawaz Where did I say all Muslims are murderers?,@MaajidNawaz Please help publicize Barrett story #FreeBB http://t.co/uixSDffvfx,"@MaajidNawaz - problem solved,   i have just been invited to join the Conservative Party ...","@BklynMiddleton yes absolutely. I've never been comfortable with that term, I used ""self-starter"" earlier, for want of an alternative",@MRobertson1971 @MaajidNawaz @Seccie Feel free to berate the noble sentiment of Nationalism - it has killed way more people.,@MaajidNawaz Just like Mohammed ordered his followers to murder people.,".@MaajidNawaz Just a lone operator? Lone? We're detecting a pattern here, even if you aren't.","@LondonSonya @MaajidNawaz I repeat, where did I say all Muslims are murderers? (I didn't, so take it back if you have any decency).","@BklynMiddleton @MaajidNawaz it's a very good point. hopefully it doesn't turn out to be a trend, because tens / hundreds of individual",@schmittpaula @MRobertson1971 @MaajidNawaz @Seccie You may as well bring up the harmfulness of cocaine to defend PCP.,@MaajidNawaz is he really a lone wolf? Do lone wolf have 15000 followers on Facebook. Surely they werent following him for his pro-rape life,"@MaajidNawaz @Seccie the problem ,Maajid is not ""any religious loner"", its a continuous stream of Muslim nut-jobs doing these attacks.","@schmittpaula @MaajidNawaz @Seccie Oh my word...I think ""tears of the Jihad"" will quash that fallacy. let alone looking at communist murders","@BklynMiddleton Yes any ""religious lone wolf"" could do this, but only muslims can find support for terrorism in their 'holy book'.","@EDLofficialpage @MaajidNawaz Get your head out of your goats ass Nawaz.Islam is a cult not a religion.God Bless UK, USA, &amp; AUSTRALIA","@MaajidNawaz #Sydneysiege selfies
http://t.co/nfr5rLKhJM",@MaajidNawaz  exactly,@MaajidNawaz - any angry nutter could do this - religion is just an excuse for them,@BklynMiddleton @MaajidNawaz ...attacks would be a terrifying scenario for the world to deal with because it's largely unstoppable.,"@MaajidNawaz True and also think this is why categorizing attacks as ""lone wolf"" now mostly an inaccurate description.",@antonioballista @MaajidNawaz so why are you still breathing if as you said ALL muslims 1 billions 700000 millions are murderers idiot,"@antonioballista @MaajidNawaz the coran is the coran, as muslims we are so  differents from one to another some are stupids and others great","@MaajidNawaz - as a ""angry white atheist "" i wish i had a ""group "" to join and brutalise ppl on behalf of ....",@MaajidNawaz A much better term.,"@antonioballista @MaajidNawaz ""Just like Mohammed ordered his followers to murder people"" did i have misunderstood you i don t think so",@MaajidNawaz @Seccie which therefore should indicate that there is something fundamentally wrong within the ideology.... No?,@Intrinsic29 @schmittpaula @MRobertson1971 @MaajidNawaz @Seccie maajid ever the penny pinching sensationalist!,"@LondonSonya @MaajidNawaz I repeat, where did I say all Muslims are murderers?",,,,,,,,,,,,,,,,,,,,,,,,,,,,,,,,,,,,,,,,,,,,,,,,,,,,,,,,,,,,,,,,,,,,,,,,,,,,,,,,,,,,,,,,,,,,,,,,,,,,,,,,,,,,,,,,,,,,,,,,,,,,,,,,,,,,,,1
